{"cost":{"additional_source_identity_validation":true,"build_byte_charge":691080,"built_points":291,"built_triangles":512,"cache_reused":false,"item_tests":6,"retained_index_layout_bytes":62463,"source_bytes":97591,"triangulation_work_charge":13824,"visited_nodes":27,"whole_snapshot_validated":true},"hits":{"kind":"points_in_sphere","points":[{"distance_meters":0.0,"point":"18446744073709551325","position_meters":[0.0,0.0,0.0]},{"distance_meters":0.0,"point":"18446744073709551326","position_meters":[0.0,0.0,0.0]},{"distance_meters":0.0,"point":"18446744073709551471","position_meters":[0.0,0.0,0.0]}]},"mesh":"sha256:7d9665a33f4e407677f4269627115d9f0899d3dc63af1301ec7fce416390df2d","profile":"mesh-local-spatial-v1","revision":"sha256:b0322adc46cc42225fa7050d58e3f7fc3f0090ff0280d107b579b2878b07567e"}
