{"cost":{"additional_source_identity_validation":true,"build_byte_charge":691080,"built_points":291,"built_triangles":512,"cache_reused":false,"item_tests":4,"retained_index_layout_bytes":62303,"source_bytes":97591,"triangulation_work_charge":13824,"visited_nodes":15,"whole_snapshot_validated":true},"hits":{"exact_tied_triangles":2,"kind":"nearest_surface","surface":{"barycentric":[0.0,1.0,0.0],"corners":["9007199254749460","9007199254749459","9007199254749458"],"distance_meters":1.7320508075688772,"face":"9007199254741482","geometric_normal":[0.0,0.0,1.0],"position_meters":[2.0,2.0,0.0]}},"mesh":"sha256:7d9665a33f4e407677f4269627115d9f0899d3dc63af1301ec7fce416390df2d","profile":"mesh-local-spatial-v1","revision":"sha256:0af25d35428ea030586081fbb5d8976f7e7bbffd698ceec8959cd3e1a1375132"}
