{"cost":{"additional_source_identity_validation":true,"build_byte_charge":6968,"built_points":3,"built_triangles":1,"cache_reused":false,"item_tests":1,"retained_index_layout_bytes":447,"source_bytes":312,"triangulation_work_charge":27,"visited_nodes":1,"whole_snapshot_validated":true},"hits":{"exact_tied_triangles":1,"kind":"nearest_surface","surface":{"barycentric":[0.5,0.25,0.25],"corners":["1","2","3"],"distance_meters":1e-81,"face":"1","geometric_normal":[0.0,0.0,1.0],"position_meters":[3.5e-82,3.5e-82,0.0]}},"mesh":"sha256:1155782018125ce293567c17df59dd3e3b7edab1c4bc34e41860ea2f0a0f3bec","profile":"mesh-local-spatial-v1","revision":"sha256:8396aee3be5f9444d983af23a2cecbc4e7ba9365ea717727b3e5b31c3f9ac153"}
